{
  "schema": "kimbar.tileset.parts.v1",
  "image": "windows-doors.png",
  "tilesetPath": "/assets/tilesets/lpc/windows-doors.png",
  "tileWidth": 32,
  "tileHeight": 32,
  "columns": 32,
  "rows": 32,
  "objects": {
    "obj.arch.brick_dark_01": {
      "tileX": 24,
      "tileY": 17,
      "tilesWide": 2,
      "tilesHigh": 2,
      "pixelWidth": 64,
      "pixelHeight": 64,
      "parts": [
        {
          "dx": 0,
          "dy": 0,
          "tileX": 24,
          "tileY": 17,
          "tileIndex": 568
        },
        {
          "dx": 1,
          "dy": 0,
          "tileX": 25,
          "tileY": 17,
          "tileIndex": 569
        },
        {
          "dx": 0,
          "dy": 1,
          "tileX": 24,
          "tileY": 18,
          "tileIndex": 600
        },
        {
          "dx": 1,
          "dy": 1,
          "tileX": 25,
          "tileY": 18,
          "tileIndex": 601
        }
      ],
      "propId": "prop.lpc_arch_brick_dark_01",
      "notes": null
    },
    "obj.arch.brick_light_01": {
      "tileX": 27,
      "tileY": 17,
      "tilesWide": 2,
      "tilesHigh": 2,
      "pixelWidth": 64,
      "pixelHeight": 64,
      "parts": [
        {
          "dx": 0,
          "dy": 0,
          "tileX": 27,
          "tileY": 17,
          "tileIndex": 571
        },
        {
          "dx": 1,
          "dy": 0,
          "tileX": 28,
          "tileY": 17,
          "tileIndex": 572
        },
        {
          "dx": 0,
          "dy": 1,
          "tileX": 27,
          "tileY": 18,
          "tileIndex": 603
        },
        {
          "dx": 1,
          "dy": 1,
          "tileX": 28,
          "tileY": 18,
          "tileIndex": 604
        }
      ],
      "propId": "prop.lpc_arch_brick_light_01",
      "notes": null
    },
    "obj.arch.stone_round_large_01": {
      "tileX": 30,
      "tileY": 14,
      "tilesWide": 2,
      "tilesHigh": 3,
      "pixelWidth": 64,
      "pixelHeight": 96,
      "parts": [
        {
          "dx": 0,
          "dy": 0,
          "tileX": 30,
          "tileY": 14,
          "tileIndex": 478
        },
        {
          "dx": 1,
          "dy": 0,
          "tileX": 31,
          "tileY": 14,
          "tileIndex": 479
        },
        {
          "dx": 0,
          "dy": 1,
          "tileX": 30,
          "tileY": 15,
          "tileIndex": 510
        },
        {
          "dx": 1,
          "dy": 1,
          "tileX": 31,
          "tileY": 15,
          "tileIndex": 511
        },
        {
          "dx": 0,
          "dy": 2,
          "tileX": 30,
          "tileY": 16,
          "tileIndex": 542
        },
        {
          "dx": 1,
          "dy": 2,
          "tileX": 31,
          "tileY": 16,
          "tileIndex": 543
        }
      ],
      "propId": "prop.lpc_arch_stone_round_large_01",
      "notes": null
    },
    "obj.container.cabinet_wood_tall_01": {
      "tileX": 26,
      "tileY": 23,
      "tilesWide": 2,
      "tilesHigh": 2,
      "pixelWidth": 64,
      "pixelHeight": 64,
      "parts": [
        {
          "dx": 0,
          "dy": 0,
          "tileX": 26,
          "tileY": 23,
          "tileIndex": 762
        },
        {
          "dx": 1,
          "dy": 0,
          "tileX": 27,
          "tileY": 23,
          "tileIndex": 763
        },
        {
          "dx": 0,
          "dy": 1,
          "tileX": 26,
          "tileY": 24,
          "tileIndex": 794
        },
        {
          "dx": 1,
          "dy": 1,
          "tileX": 27,
          "tileY": 24,
          "tileIndex": 795
        }
      ],
      "propId": "prop.lpc_container_cabinet_wood_tall_01",
      "notes": null
    },
    "obj.container.cabinet_wood_tall_02": {
      "tileX": 26,
      "tileY": 25,
      "tilesWide": 2,
      "tilesHigh": 3,
      "pixelWidth": 64,
      "pixelHeight": 96,
      "parts": [
        {
          "dx": 0,
          "dy": 0,
          "tileX": 26,
          "tileY": 25,
          "tileIndex": 826
        },
        {
          "dx": 1,
          "dy": 0,
          "tileX": 27,
          "tileY": 25,
          "tileIndex": 827
        },
        {
          "dx": 0,
          "dy": 1,
          "tileX": 26,
          "tileY": 26,
          "tileIndex": 858
        },
        {
          "dx": 1,
          "dy": 1,
          "tileX": 27,
          "tileY": 26,
          "tileIndex": 859
        },
        {
          "dx": 0,
          "dy": 2,
          "tileX": 26,
          "tileY": 27,
          "tileIndex": 890
        },
        {
          "dx": 1,
          "dy": 2,
          "tileX": 27,
          "tileY": 27,
          "tileIndex": 891
        }
      ],
      "propId": "prop.lpc_container_cabinet_wood_tall_02",
      "notes": null
    },
    "obj.door.double_white_glass_01": {
      "tileX": 28,
      "tileY": 30,
      "tilesWide": 1,
      "tilesHigh": 2,
      "pixelWidth": 32,
      "pixelHeight": 64,
      "parts": [
        {
          "dx": 0,
          "dy": 0,
          "tileX": 28,
          "tileY": 30,
          "tileIndex": 988
        },
        {
          "dx": 0,
          "dy": 1,
          "tileX": 28,
          "tileY": 31,
          "tileIndex": 1020
        }
      ],
      "propId": "prop.lpc_door_double_white_glass_01",
      "notes": null
    },
    "obj.door.double_white_glass_02": {
      "tileX": 30,
      "tileY": 30,
      "tilesWide": 1,
      "tilesHigh": 2,
      "pixelWidth": 32,
      "pixelHeight": 64,
      "parts": [
        {
          "dx": 0,
          "dy": 0,
          "tileX": 30,
          "tileY": 30,
          "tileIndex": 990
        },
        {
          "dx": 0,
          "dy": 1,
          "tileX": 30,
          "tileY": 31,
          "tileIndex": 1022
        }
      ],
      "propId": "prop.lpc_door_double_white_glass_02",
      "notes": null
    },
    "obj.door.double_wood_red_01": {
      "tileX": 28,
      "tileY": 25,
      "tilesWide": 2,
      "tilesHigh": 2,
      "pixelWidth": 64,
      "pixelHeight": 64,
      "parts": [
        {
          "dx": 0,
          "dy": 0,
          "tileX": 28,
          "tileY": 25,
          "tileIndex": 828
        },
        {
          "dx": 1,
          "dy": 0,
          "tileX": 29,
          "tileY": 25,
          "tileIndex": 829
        },
        {
          "dx": 0,
          "dy": 1,
          "tileX": 28,
          "tileY": 26,
          "tileIndex": 860
        },
        {
          "dx": 1,
          "dy": 1,
          "tileX": 29,
          "tileY": 26,
          "tileIndex": 861
        }
      ],
      "propId": "prop.lpc_door_double_wood_red_01",
      "notes": null
    },
    "obj.door.shrine_small_01": {
      "tileX": 30,
      "tileY": 19,
      "tilesWide": 1,
      "tilesHigh": 2,
      "pixelWidth": 32,
      "pixelHeight": 64,
      "parts": [
        {
          "dx": 0,
          "dy": 0,
          "tileX": 30,
          "tileY": 19,
          "tileIndex": 638
        },
        {
          "dx": 0,
          "dy": 1,
          "tileX": 30,
          "tileY": 20,
          "tileIndex": 670
        }
      ],
      "propId": "prop.lpc_door_shrine_small_01",
      "notes": null
    },
    "obj.door.vault_iron_studded_01": {
      "tileX": 28,
      "tileY": 23,
      "tilesWide": 2,
      "tilesHigh": 2,
      "pixelWidth": 64,
      "pixelHeight": 64,
      "parts": [
        {
          "dx": 0,
          "dy": 0,
          "tileX": 28,
          "tileY": 23,
          "tileIndex": 764
        },
        {
          "dx": 1,
          "dy": 0,
          "tileX": 29,
          "tileY": 23,
          "tileIndex": 765
        },
        {
          "dx": 0,
          "dy": 1,
          "tileX": 28,
          "tileY": 24,
          "tileIndex": 796
        },
        {
          "dx": 1,
          "dy": 1,
          "tileX": 29,
          "tileY": 24,
          "tileIndex": 797
        }
      ],
      "propId": "prop.lpc_door_vault_iron_studded_01",
      "notes": null
    },
    "obj.door.wood_arched_plain_01": {
      "tileX": 25,
      "tileY": 28,
      "tilesWide": 1,
      "tilesHigh": 2,
      "pixelWidth": 32,
      "pixelHeight": 64,
      "parts": [
        {
          "dx": 0,
          "dy": 0,
          "tileX": 25,
          "tileY": 28,
          "tileIndex": 921
        },
        {
          "dx": 0,
          "dy": 1,
          "tileX": 25,
          "tileY": 29,
          "tileIndex": 953
        }
      ],
      "propId": "prop.lpc_door_wood_arched_plain_01",
      "notes": null
    },
    "obj.door.wood_arched_plain_02": {
      "tileX": 27,
      "tileY": 28,
      "tilesWide": 1,
      "tilesHigh": 2,
      "pixelWidth": 32,
      "pixelHeight": 64,
      "parts": [
        {
          "dx": 0,
          "dy": 0,
          "tileX": 27,
          "tileY": 28,
          "tileIndex": 923
        },
        {
          "dx": 0,
          "dy": 1,
          "tileX": 27,
          "tileY": 29,
          "tileIndex": 955
        }
      ],
      "propId": "prop.lpc_door_wood_arched_plain_02",
      "notes": null
    },
    "obj.door.wood_arched_stoneframe_pair_vertical_01": {
      "tileX": 20,
      "tileY": 22,
      "tilesWide": 2,
      "tilesHigh": 5,
      "pixelWidth": 64,
      "pixelHeight": 160,
      "parts": [
        {
          "dx": 0,
          "dy": 0,
          "tileX": 20,
          "tileY": 22,
          "tileIndex": 724
        },
        {
          "dx": 1,
          "dy": 0,
          "tileX": 21,
          "tileY": 22,
          "tileIndex": 725
        },
        {
          "dx": 0,
          "dy": 1,
          "tileX": 20,
          "tileY": 23,
          "tileIndex": 756
        },
        {
          "dx": 1,
          "dy": 1,
          "tileX": 21,
          "tileY": 23,
          "tileIndex": 757
        },
        {
          "dx": 0,
          "dy": 2,
          "tileX": 20,
          "tileY": 24,
          "tileIndex": 788
        },
        {
          "dx": 1,
          "dy": 2,
          "tileX": 21,